{
  "assumption_set_id": "as-pfcore-demo-v0.1",
  "schema_version": "v0",
  "created_at": "2026-06-27T12:00:00Z",
  "producer": "pcs-core",
  "producer_version": "0.1.0",
  "source_repo": "https://github.com/example/pcs-core",
  "source_commit": "cccccccccccccccccccccccccccccccccccccccc",
  "assumptions": [
    {
      "assumption_id": "asm-pfcore-lean-deferred",
      "text": "Lean kernel proof and library build checks were skipped; assurance is AssumptionDeclared only.",
      "kind": "policy",
      "status": "HumanReviewed",
      "source_span_refs": []
    }
  ],
  "human_review_status": "approved",
  "status": "HumanReviewed",
  "signature_or_digest": "sha256:2222222222222222222222222222222222222222222222222222222222222222"
}
